{
  "as_of": "2026-08-02T00:00:00Z",
  "cohorts": [
    {
      "anchor_status": "pending",
      "cohort_id": "tier_a_session_lifecycle_staleness",
      "deltas": null,
      "gate": "A60",
      "reasons": [
        "anchor_pending"
      ],
      "recurrence_candidates": [],
      "result": "insufficient_data",
      "windows": {
        "post": null,
        "pre": null
      }
    },
    {
      "anchor_status": "blocked",
      "cohort_id": "tier_b_agent_bridge_lifecycle",
      "deltas": null,
      "gate": "bridge_B60",
      "reasons": [
        "peer_decision_blocked"
      ],
      "recurrence_candidates": [],
      "result": "insufficient_data",
      "windows": {
        "post": null,
        "pre": null
      }
    },
    {
      "anchor_status": "blocked",
      "cohort_id": "tier_b_transport_lifecycle",
      "deltas": null,
      "gate": "transport_B60",
      "reasons": [
        "peer_decision_blocked"
      ],
      "recurrence_candidates": [],
      "result": "insufficient_data",
      "windows": {
        "post": null,
        "pre": null
      }
    }
  ],
  "schema_version": 1,
  "vertical_slice_soak": {
    "incidents": [],
    "reasons": [
      "soak_pending"
    ],
    "result": "insufficient_data",
    "status": "pending",
    "window": null
  }
}
